{
  "schema_version": "ao.forge.live-mutation-dry-run-plan.v0.1",
  "plan_id": "forge-live-mutation-plan-docs-multi-0001",
  "mode": "dry_run_only",
  "target": {
    "repo": "ao-atlas",
    "allowed_path_class": "docs_only",
    "allowed_paths": [
      "README.md",
      "docs/sdd/AO-ATLAS-WORKGRAPH.md"
    ],
    "mutation_class": "docs_only_multi_file"
  },
  "covenant_authority": {
    "required": true,
    "status": "approved_dry_run_fixture",
    "schema_version": "covenant.live-mutation-authority.v1",
    "authority_packet": "examples/live-mutation/docs-multi-authority.packet.json",
    "authority_packet_sha256": "1111111111111111111111111111111111111111111111111111111111111111"
  },
  "worktree_isolation": {
    "required": true,
    "status": "planned",
    "branch": "codex/docs-multi-live-rehearsal",
    "isolated_worktree": true,
    "clean_worktree_required": true,
    "reuse_existing_worktree": false
  },
  "verification": {
    "required": true,
    "commands": [
      "git diff --check",
      "scripts/production-readiness.sh"
    ],
    "evidence": [
      {
        "label": "planned-verification",
        "path": "examples/live-mutation/evidence/docs-multi-verification-plan.json",
        "sha256": "2222222222222222222222222222222222222222222222222222222222222222"
      }
    ]
  },
  "pr_lifecycle": {
    "required": true,
    "status": "planned",
    "one_branch_at_a_time": true,
    "requires_green_checks": true,
    "merge_method": "squash_if_rebase_unavailable",
    "delete_branch_after_merge": true
  },
  "rollback_rehearsal": {
    "required": true,
    "status": "planned",
    "rollback_plan": "examples/live-mutation/rollback/docs-multi-rollback-plan.json",
    "rollback_plan_sha256": "3333333333333333333333333333333333333333333333333333333333333333",
    "quarantine_on_failure": true
  },
  "provider_boundary": {
    "provider_calls_allowed": false,
    "requires_exact_digest_approval": true
  },
  "execution_boundary": {
    "mutates_live_repo": false,
    "creates_release": false,
    "pushes_tags": false,
    "uploads_artifacts": false,
    "operator_kill_switch_required": true
  },
  "next_actions": [
    {
      "action_id": "request-class-bound-docs-multi-packet",
      "description": "Request exactly one docs_only_multi_file patch packet after Atlas, Covenant, Sentinel, Promoter, Command, rollback, and CI evidence are ready.",
      "required": true
    }
  ]
}
